,0,1,2,source
1461,"Brass it out,",Ye,Orchestras!,gutenberg
1462,"But oh, leave not in doubt Its import, Kipling,--that","'tis maelstrom roar-- 'Tis England's streams of home-life, world about And","down a gulf, for Greed and Pride on shore!",gutenberg
1463,"Aye, weapons only; for, to whom belong","The minds of England, and treed fields of song-- Nay,","all but grave-ground, grudged by hill and plain?",gutenberg
1464,"O English People, whom the crafty class Has","huddled into graves from sight and sound Of what God hands you,","and, with pence, or pound, Lids down your wild dead stare,--wake!",gutenberg
1465,why so,crass?,,gutenberg
1466,See in the Celts spring-burst,"from underground, The Human",Resurrection come to pass.,gutenberg
1467,"Oh, what are England's lines","of lords and kings, Shakespeare, to thine, a-throb",with thought and feeling?,gutenberg
1468,The,righteousness,of England!,gutenberg
1469,"""Tis to kneel Full weight on weaker nations,",and entone Hosannas louder than the victims groan;,"Then, stooping, drink their blood with gulps of zeal.",gutenberg
1470,""" What right have wounds,","though wide, to throb,",or feel?,gutenberg
1471,'Tis blasphemy,to England's crimson,throne.,gutenberg
1472,Knee-deep in Erin's,"blood, she mocks Christ's moan: Forgive","them, Lord!",gutenberg
1473,they,know not their true,weal.,gutenberg
1474,"""Whose",is the,fault?,gutenberg
1475,"Tis not my arrogance,","But candor, Lord, that puts the",blame on Thee.,gutenberg
1476,What right hadst Thou to make,these people free And let all nature,prompt them to advance?,gutenberg
1477,"-- Oh, no such blunder, Lord,","hadst Thou called me, Instead of Wisdom,",to approve Thy plans!,gutenberg
1478,""" The Bard's curse: ""Ruin","seize thee Ruthless King,"" Took bat-like",form for hollow echo-flight.,gutenberg
1479,"Oh, to my sight,","How grows its grimness, while",eternaling!,gutenberg
1480,"Deep are the minds of Wales, but far more deep","The horror, gulfed out by McCreedy, firing On","men defenseless and, through want, expiring.",gutenberg
1481,"Oh, from that gulf the Bard's curse makes a sweep","Up to the Sun and, from its long desiring, Grown eagle,",shrieks to heaven from steep to step!,gutenberg
1482,"""A dirty work,"" said Dyer,",rebuked for spilling Hundreds of lives to,irrigate new lands.,gutenberg
1483,"A dirty work, but not","for British hands, Dabbling in",blood to earn each day their shilling.,gutenberg
1484,"Mohawk Valley and Wyoming, chilling With","thought of Tarleton's King-serving bands, And Canada red-clayed, though high snow stands,",Cry: Work for which the British are too willing!,gutenberg
1485,Invaded lands need terror,irrigation To make,them fruitful.,gutenberg
1486,"The ocean, holding pure the azure's","blue, Laughs at the tempests, with one empire's dust","After an other, to round out Earth's crust.",gutenberg
1487,"Look in the sea and deep,","what scattered rock, The islands which","at dusk, the tempest piled!",gutenberg
1488,Ere rose,"a star, they sank with","crews, beguiled.",gutenberg
1489,"O Tempests that with world formations,","mock The good Creator, how, as ye grow wild, Earth quakes",and no live thing survives the shock.,gutenberg
1490,Our country is,"not rock and wood and stream, But",soul transfusing them.,gutenberg
1491,What,is the,soul?,gutenberg
1492,"The soul, then,--our true country,--is the brave","Who fought and bled for Freedom, or will fight To their","last pulse, last breath, for Human Right.",gutenberg
1493,"oh, how like bubbles in the wave,","Are the Sierras in cerulean flight, To thy","true grandeur, letting nought enslave!",gutenberg
1494,O thou art Character--art,only those Who formed the good and,"great by thought, or deed.",gutenberg
1495,"No mere foot-shadow, on time's wall, art thou,","Without eye-sparkle, swing of arm, warm flow From heart","to vain, and cheeks with health of glow.",gutenberg
1496,"Oh, 'tis eternal heights reflect thy","brow And shoulders, that avert man's overthrow, Threatened","all times, and never more than now.",gutenberg
1497,"Oh, what if",lone and long thy lofty,"flight, My country?",gutenberg
1498,Is thy vision not as,"clear As that of Vesper, dauntless pioneer",On Twilight's altitude?,gutenberg
1499,"How thy lone loftness, aloof","from wrong, Refracting man-ward, God's enrapturing smile","Of fruitful fields, leads legions!",gutenberg
1500,"On they file And phalanx, and","the vision makes thee strong: What, though God's searchlight",flares the sky the while?,gutenberg
1501,It nears not,"thee, ear-close to heaven's",high song.,gutenberg
1502,From out a desert where the,"trails run red, Judah and Erin speed","their camel pace, Sighting green palms.",gutenberg
1503,""" Who, in descent from Heaven's ecstatic throng, Was","twin to light, and ranged from source to sea, And shore to peak, and God, drew","up to thee The generations happy, pure and strong?",gutenberg
1504,"Freedom, as Erin's was, ere","ruthless wrong Caught, scourged and hanged it on the",out-law's tree; And is; for lo!,gutenberg
1505,"it proves Divinity,","Transfiguring from anguish,",ages long.,gutenberg
1506,"True, they have strangled Freedom on","the cross Of every Right's suppression--nay, have barred","His body's tomb, and placed a host on guard!",gutenberg
1507,"Still, He is",risen; His faithful,mourn no loss.,gutenberg
1508,He shines,forth in their,midst.,gutenberg
1509,No bolts retard,"His entrance, where grand aims",for life engross.,gutenberg
1510,The fight in,Ireland is,'twixt Man and Brute.,gutenberg
1511,"A lion with the sea-surge for his mane,","Is there hurled back by Man with proud disdain, Although",heart-drained with gash from head to foot.,gutenberg
1512,"Oh, in that Eden of Forbidden Fruit, How","Satan, searching for a snake in vain, Fumed forth a monster from his",heart and brain-- The Lion--as the serpent's substitute!,gutenberg
1513,"Oh, all ye",peoples of the World,draw nigh!,gutenberg
1514,"How help love thee, whose hand,","raised to the sun, Glows rosy, and",not red with murder's stain?,gutenberg
1515,The,angels,kiss it.,gutenberg
1516,Force can,forge no chain To,drag thee false-ward.,gutenberg
1517,"Like a holy Nun, Stigmated,","how thy faith grows with thy pain-- Aye, till thy","Cross, like Constantine's has won.",gutenberg
1518,"In rapt, roused Erin, who does not","behold A Venus, rising from the sea of","tears, Up to her native, Earth-illuming spheres?",gutenberg
1519,where the green,"and orange morn unfurls, See",Erin rise.,gutenberg
1520,How shine her,golden,tresses!,gutenberg
1521,"They form her crown, for trailing rocks down whirls, And reaching","all the under-sea recesses, They draw about her brow, the rarest pearls--",Love for what frees and hate for what oppresses!,gutenberg
1522,"Look,",Human,Nature!,gutenberg
1523,Where else canst thou,boast To the eternal,"stars, so grand a sight?",gutenberg
1524,How men there ennoble,human kind By making Liberty,the light to Peace!,gutenberg
1525,All other,lights are false.,,gutenberg
1526,who but sees In the unconquerable,"Celtic mind That, even in Time, there are Eternities--","Love, true to Right, and Will no wrong can bind!",gutenberg
1527,Why play,with,words?,gutenberg
1528,There never,can be peace Till Ireland,is set free.,gutenberg
1529,Her spirit is no,norbury Banshee-- To wail,"and, then, to vanish.",gutenberg
1530,"She will stand With lifted flambeau, lighted by","the hand That lights the stars, till she again is free, Inspiring normal","man in every land With love of Freedom, by her scorn of thee.",gutenberg
1531,"Stop foul God-slaughter where to not rebel,","In order to develop and excel, Were God","in man, succumbed to age-longed blights.",gutenberg
1532,""" Where Heavenward rose","the God in man of old, Staunch",stand these Wardens.,gutenberg
1533,"Sleepless, they behold",Each turn of England's,Evil Eye.,gutenberg
1534,"They call, When she would form the fulminate","of gold, A thumb and finger-pinch of which, let fall, Might blast",Columbia's peaks to slit of thrall.,gutenberg
1535,"Of all the fulminates, gold is the worst, Which","England, aeroplaning, now, lets drop By day and night, in bank, press, church and","shop, Timed to the minute that it is to burst.",gutenberg
1536,"List to Demosthenes,","if not to Hearst, Sublime",Republic!,gutenberg
1537,"Lest thy great heart stop, Shocked by","the blast of Freedom's every prop, And","bats and owls in dwellings, Human's erst.",gutenberg
1538,"She drops her gold,",in creeping Beneath,free Athens' sky-ascending stair.,gutenberg
1539,Watch,her with glance of,sword.,gutenberg
1540,"Oh, watch, for where","She sows her gold, she comes",with scythes for reaping!,gutenberg
1541,Is Athens in ascent,"with sun-light flare, To come down ashes,",not worth history's keeping?,gutenberg
1542,"-- Sole trail, as","time, who peers through grief,",discerns.,gutenberg
1543,"O Caledonia, by thy Burn's brave","song, And deeds of Wallace and Paul Jones for Right, Thy mother knows","thee in the dark of night, And claps thee heart-close.",gutenberg
1544,She cries,"out: ""Be strong, Soul",of my soul!,gutenberg
1545,though not a Boswell,"quite, Still, be whole",man!,gutenberg
1546,remember,Glencoe's,wrong.,gutenberg
1547,"--Still, there's",the blaze!,,gutenberg
1548,There's England's,soul of merciless,intriguing!,gutenberg
1549,'tis the,bagpipes welcoming,the guest.,gutenberg
1550,See the,"assembly,",dance and feast.,gutenberg
1551,"Oh, watch The open heart","and flow of good old Scotch; The English come,","as friends, must have the best.",gutenberg
1552,"There, hospitality","is at top notch,-- And so is",treachery in Britain's breast.,gutenberg
1553,The,cock,crows.,gutenberg
1554,--Is,he,dreaming?,gutenberg
1555,'Tis,dark,still.,gutenberg
1556,"He crows again and now, from farm","to farm, His fellows echo far his dazed alarm",And flap of wings on fences.,gutenberg
1557,with such lamp in hand,"As Glencoe's horror,",thou hast England true.,gutenberg
1558,Why let Froude fiction,haze thy vivid,view?,gutenberg
1559,"Put not thy light out for sound sleep,","but stand And answer, when the mother, whom thou","drew Thy soul from, cries ""Glencoe""!",gutenberg
1560,when,Black,and Taned.,gutenberg
1561,"O Canada,",Long red with cottage,flame From Britain's torch!,gutenberg
1562,thy blasts milk not the cloud To nourish,"hope; instead, they spread the shroud On Human Spirit",answering Freedom's claim.,gutenberg
1563,"Whence comes the cold which icicles with shame, Thy heart's","Niagara, that should thunder loud Unto thy far off soul in sorrow,","bowed O'er Papineau, whom Thraldom could not tame?",gutenberg
1564,Whence comes this,cold to Freedom's,claim?,gutenberg
1565,"we know Only too well,--from creatures of the","King, Who had dragged Hell of every poisonous thing","And, through our country, had spread waste and woe.",gutenberg
1566,"Beaten at last, they flocked like carion crow, On","the dead body of their will to sting, Which drifting Northward, and","enlargening, Loomed Dante's Nimrod, 'mid the Arctic snow.",gutenberg
1567,with Sun-warmth for Truth and,"Human Right, Is",Boreus met.,gutenberg
1568,Who hurles,him down,the deep?,gutenberg
1569,"Look close;--'tis Gladden who, on Freedom's steep, Is as","inspiring, as, on Andes' height, The great Christ Statue, bidding Rancor","sleep And Life's diverging rays in love, beam Light.",gutenberg
1570,why,all this sleigh-bell,rhyming?,gutenberg
1571,God said to Wrong:,"""No further shalt",thou go.,gutenberg
1572,""" This, Monroe","heard and held, then, in",his heart.,gutenberg
1573,"It was this he repeated,","when on chart He made his markings, checking",Freedom's foe.,gutenberg
1574,God never grants to Wrong the right to grow; Because,"He sets its bounds, does not impart His blessing on its growth, more than its","start; His blessing goes to Right, to overthrow.",gutenberg
1575,"Oh, let thine",eyes for migratory,flight Speed southward!,gutenberg
1576,"Passing Prejudice's Lake, Green-crusted with stagnation","which some take For verdure, they will see from Andes' height, How Freedom's battle forms the","red day-break, And tides are swells from thrall, hurled deep from sight.",gutenberg
1577,From South,"to North, no sky",is black but thine.,gutenberg
1578,We seek no,"annexation, but of","Mind, Heart, Spirit.",gutenberg
1579,"Rise, and be one",On the new world's Star-top,of Liberty.,gutenberg
1580,"""The Angels come in","dreams,"" says Holy Writ; And Science says,","""No sleep so deep, but dreams.",gutenberg
1581,whose pure soul and heart embrace Translates,"me into heaven, I draw for breath The joy of",angels who have not known death.,gutenberg
1582,"Child-like, I look up in thy loving","face, Else gaze around and point, and curious place","My hand on Mottoes, hung on high.",gutenberg
1583,"One saith: ""Beware,",for he not with,me scatterith.,gutenberg
1584,""" Its meaning",comes to me with,"growth, like grace.",gutenberg
1585,"Think the tyrant, whose great soul is trade, Whose history,","a crater, belching black And lurid, keeps glad Easter morning back From","half the world--loves thee save to invade, As blackward planned?",gutenberg
1586,"loves thee, along whose track",March Human rights up to,the stars parade?,gutenberg
1587,There where the Tyrant long,"has loomed, wreck-crowned, Are young and old",hurled to the coast and blast.,gutenberg
1588,"Frail are their ships; still,","Sun, why glare aghast, Watching the",billows monstering around?,gutenberg
1589,The soul,of man was not born to,be drowned.,gutenberg
1590,"It mounts and mounts, till, at God's throne, at last,","And freedom welcomes it with arms, sky-vast, As down",it comes to meet Thrall and confound.,gutenberg
1591,"O, deathless spirit, born of hosts","sea-hurled, Who hast out soared night's stars with",agony's cry For justice!,gutenberg
1592,"Thou hast come down from the sky, Heralding doom","to Thrall, whose flag unfurled By steel, or craft, shows, as 'tis hoisted high,",The blood of man and ruin of the world.,gutenberg
1593,What,is,the Truth?,gutenberg
1594,"The thought, the act, or cry,",Recasting the Supreme Intelligence;,All else is false.,gutenberg
1595,"where are stars so dense,",That each has not the freedom,of the sky?,gutenberg
1596,"And, still,","what peace, what glory,",reigns on high!,gutenberg
1597,with the,wisdom of the,"heavens, dispense?",gutenberg
1598,"The Peace, for which our","longings grow intense, Comes through the stars","to earth, and but thereby.",gutenberg
1599,What splits,dark mid-night and gives earth,a thrill?,gutenberg
1600,All stars,merged into one--our Country's,aim.,gutenberg
1601,"It is a lightening, formed by God, to flame Across","the ages and flash bolts to kill The stranglers, who the heart or spirit,","main, Or choke black in the face, a People's Will.",gutenberg
1602,Who is to rise and hurl God's,"flame world-wide, As Lincoln hurled it, setting free a race From",Sphinx-shaped wrong--a beast with human face?,gutenberg
1603,"That shattered, how our","land rose glorified And, from the","stars last laggard, soared, their guide!",gutenberg
1604,"Oh, who can take Promethean","Lincoln's place, To bring light where-so-ever he can trace A","Human, with his rights to soul denied?",gutenberg
1605,"He must be one, not only to illume All ages,","and not leave one region dim, But at no height, allow his senses swim,",Or let mirages lure him with false bloom.,gutenberg
1606,Here one comes with all,the virtues prim To hurl God's,fire and end all human gloom.,gutenberg
1607,'Tis Wilson,takes God's flame from Lincoln's,hand.,gutenberg
1608,Why not hurl them,"and convince The world that,","hence-forth, not one thrall shall stand?",gutenberg
1609,Wilson's arm lacks strength to,"hurl the flame, God gave to Lincoln",for the Human race?,gutenberg
1610,Quenched by,dark,space?,gutenberg
1611,"No; it describes an orbit there, the same","As comets, and regains its heavenly place For","one to hurl it true, and doom Earth's Shame.",gutenberg
1612,In Wilson we beheld,and proudly hailed The World's,Deliverer.,gutenberg
1613,"In him, we saw A",luminous being rise from earth,and draw All lands above the clouds.,gutenberg
1614,We were regaled With justice,"cascades flow, long ice impaled",Upon high mountains.,gutenberg
1615,Was not Nature's,thaw From his heart heat for,"truth, Eternal Law?",gutenberg
1616,His was,the heat of all,"the stars, he scaled.",gutenberg
1617,"Though his ascension was like Christ's, sublime","With lift of continents and every isle, He,","less than Christ, succumbed to Demon Guile.",gutenberg
1618,"Oh, God, that he should drop his mountain","climb Below sea-level, and let earth the while, Fall back",and settle in Primeval Slime!,gutenberg
1619,"Oh, such his truth to God,--so oft avowed,--",A spirit thund'red from a luminous cloud:,"""This man crowns Lincoln's work.",gutenberg
1620,""" Oh, had",he read his bible,where St.,gutenberg
1621,"Paul, Grown man, put off","child things--or, had not smiled, When told, strong Ego","oft, is man grown child!",gutenberg
1622,Who sees not an Epoch's Angel,"Fall From hope for earth, in Wilson's truth, beguiled By",second childhood's toys to play with thrall?,gutenberg
1623,Our Country,still is in the,"womb, dark Time.",gutenberg
1624,It shows life by its brisk and,"robust turns, Which thrill the Mother, Liberty,",who yearns To see her man-child born.,gutenberg
1625,"Oh, how sublime With genius, not of one, but every","climb Where art forms beauty, or the spirit spurns The foul and spurious,--her","desire, that burns Prenatally in him, to form him prime!",gutenberg
1626,"Oh People, all--Italian, Spanish, French,","Dutch, English, Irish, German, Jew, and Greek-- What see","you, as you climb the Future's Peak?",gutenberg
1627,"What looms there, shall wrench From life, all","monsters out from Hell, to seek Dead consciences",and plague earth with their stench.,gutenberg
1628,"Ascend, O",Land of every,Creed and Race!,gutenberg
1629,"Not thy full image, in New England's","brook, Nor in the South's lagoon; though there, a look Delights","us with thy chubby, infant face.",gutenberg
1630,"'Tis seas of joy, that shorelessly replace The Ocean","which, in time of old, forsook The prairies for the cloud, or spring","in nook,-- That show thee, Grown, through God's abundant grace.",gutenberg
1631,"Behold two fleets, the","one with woe for trail, The","other, rapture.",gutenberg
1632,"As they sight the strait, Through which but","one can pass, Greed, urged by Hate, Drives Thraldom's",crafts with help of steam and gale.,gutenberg
1633,They,feel their,way.,gutenberg
1634,"The guns, with which they hale, Raise jets, that look tall","elms from Hope, the gate, To Peace, the Palace; then, their speed is great,","Manoeuvering fast to head off, or assail.",gutenberg
1635,"Drawing the sea up for his driving steam, Greed breaks all","mirrors in his grand state room, That show him dark inevitable","doom, Close hovering, and exults: ""I am Supreme.",gutenberg
1636,When seas lack water for my,"funnel fume, I bid life send its",every crimson stream.,gutenberg
1637,in the darkness lowers,"boat after boat From Freedom's fleet,",and each with lightening oars?,gutenberg
1638,Treasons to God,and country are,the rowers.,gutenberg
1639,They are the Gold and,"Hireling Brain, that gloat On conscience","body with face down, afloat.",gutenberg
1640,"Why hail they Greed, to run on","menial chores From deck to deck,",or to and from all shores?,gutenberg
1641,To ensure,the payment of,a note.,gutenberg
1642,"Meanwhile, brisk Freedom's fleets with justice manned,","And cosmic full momentum for their speed, Confront","the crafts, fired up by fiendish Greed.",gutenberg
1643,A,clash,and--lo!,gutenberg
1644,"they pass the strait and land, Leaving in","smoldering heaps, like autumn's weed, The hulks of",thrall along time's vultured strand.,gutenberg
1645,Are lust for Gold and Power,not hideous spawn Of prehistoric,"reptiles, that had wings?",gutenberg
1646,"Where e'er those crawled, they chawed all greening things And,","when they mounted, how their lengths, full drawn, Basked barren in the sun before","the dawn, Absorbing all its rays from budding Springs?",gutenberg
1647,These drain life's dawn and by,"impoverishings, Draw and reduce","to pulp, frail Consciences.",gutenberg
1648,"Oh, yea, bewinged with legislative crime, They bask","in sunlight e'er the east sky greys, And drag the soul of",man from God's embrace Of rights and freedom.,gutenberg
1649,"Oh, how long a time Shall reptiles,","deadly to the Human race, Be let grow",wings and heavenward trail their slime?,gutenberg
1650,What though fine graphic sketches,In magazines show them with shoulders bold Against,the nights flood-gates of dark and cold?,gutenberg
1651,All effort,is but life in death-throw,stretches.,gutenberg
1652,"O heart and brain, who see the father","load His train with food, not for the few, but all, And hear","train-whistlings in March winds, jay call And ground-hog sniffs!",gutenberg
1653,"O heart and brain, it","rest with you, how long The legislative",wreckers shall prevail.,gutenberg
1654,Ye have,the power to,balk them.,gutenberg
1655,,"Why then,",fail?,gutenberg
1656,Regain,your,legislatures.,gutenberg
1657,Man them strong And drive thence all,"sleek hounds, trust-trained to trail Safe outlaws' paths",to fastnesses of wrong.,gutenberg
1658,Was ever such unblushing,"harlotry, Such sale of virtue in the","Market place, As by the Press?",gutenberg
1659,The red paint on her,face Is Degradation's,mark.,gutenberg
1660,"Alas, that she, Born to bring forth the truth,","still, is so base, She kills her child and, then, to hide all trace,","Cracks bone by bone to dust, too fine to see.",gutenberg
1661,"O Press, poor harlot of","the tyrant, Gold, What freedom, but","from truth, hast thou to boast?",gutenberg
1662,"Hark, who now speaks is","murdered Truth's pale ghost: ""Conceiving","life--oh, bring it forth!",gutenberg
1663,"aye, hold Thy",child on high with,"love, as priest, the Host!",gutenberg
1664,Crush not,"its bones, with smile and eyes",set cold.,gutenberg
1665,""" What",is the,truth?,gutenberg
1666,The focus of,all rays Passing through Nature,and the soul and mind.,gutenberg
1667,It is the Sun of,"Suns, around which wind The Heavens",and all the worlds.,gutenberg
1668,"Such is its blaze, That had it not, at intervals,","a haze, Grading both Angel and the Human-kind, The bright Arch-angel would be stricken","blind, To grope in Heaven, a Homer, sighing lays.",gutenberg
1669,What less could fitly crown,"Omnipotence Than Truth, the focus",of all rays in Good?,gutenberg
1670,"there it shines upon the Holy Rood, Breaking through","clouds, a-massing dark and dense From countless ages, Cains to Brotherhood--",With rays of pardon for the World's offense.,gutenberg
1671,"""Forgive","them, Sire!",,gutenberg
1672,They,know not what,they do.,gutenberg
1673,"All grandeurs, gathered as a dazzling","crown For thee, in barter for thy knee's least bend, The",Demon dashed to fragments to Time's end.,gutenberg
1674,"There, born anew in spirit, we look","down And, in the ocean of thy prayer, Amen'd,","See but earth's monsters, with the demons drown.",gutenberg
1675,Thought is truth's echo--not her,"glorious eyes Beholding God, nor her white","arms of light, Lifted in worship.",gutenberg
1676,"Following truth, our",flight At highest range is where,our echo dies.,gutenberg
1677,Oh all your,"power and beauty,",earth and skys!,gutenberg
1678,"And,",Soul and,Mind!,gutenberg
1679,your Beauty and your Might-- Truth,"gathers in one flash and, catching sight Of God,",lifts high in love's full sacrifice.,gutenberg
1680,"Twixt Truth and Thought, what Truth is","oft is space Wherein, with intuition","for her wing, The soul mounts.",gutenberg
1681,"It is there I hear her sing: ""Lo, Truth, so swift","aloft, Thought dies in chase, Turns earthward, and the gifts her white arms","bring, Are outshone by God's glory in her face!",gutenberg
1682,""" Ah,",what is,Heaven?,gutenberg
1683,Such Glory that Sun-light,"Seems darkness, and Mass","Music, shell-shut sound.",gutenberg
1684,"What we call senses here, there so abound,","The soul appears a broadening heaven in flight, Feathered and","downed with all the stars, whose white Is all hues mingled.",gutenberg
1685,"Oh, the",awe,profound!,gutenberg
1686,For every moment,"there, new Heavens astound The myriad","senses, with God's Love and Might.",gutenberg
1687,"If ""Holy,","Holy, Holy,",Evermore?,gutenberg
1688,Was not humility the Earthward,"stair From highest Heaven, by which God came to men, To",show the way aloft to human ken?,gutenberg
1689,"Ah, by what other pass, are men to fare","Through mist and cloud, except the path, aflare With his","blest steps from Heaven, and up again?",gutenberg
1690,"Steps, not from star to","star, but fen to fen, That all might follow",and not one despair!,gutenberg
1691,"Oh,",steps,of Love!,gutenberg
1692,Could we reach with our eyes Their,"fulgence, we would shrink back with dismay; For, though",'tis through the world's contempt move they-- Hark!,gutenberg
1693,How the hidden choirs of countless,"skies Chant at all heights: ""Lo, God comes by this way, And","makes world-wide, His stair to Paradise!",gutenberg
1694,"Oh cataracts, beyond the","angels' count, Pause and shine pendant over every","deep Of heart, mind, spirit!",gutenberg
1695,"how down they sweep To basic Good where, massing,","they remount, Till, mid God's ""Many Mansions,"" high they leap, Forming","forever, joy's most splendent fount!",gutenberg
1696,"When, at God's fiat, Light flashed","forth, the beam Evolved a million pigments,",as it sped To every nature.,gutenberg
1697,"For, harboring",meaner thought were,to blaspheme.,gutenberg
