,0,1,2,source
4071,"Laughing, dancing, sunny wind,","Whistling, howling, rainy wind, North, South, East and West,",Each is the wind I like the best.,gutenberg
4072,"The pine trees toss him their cones with glee, The","flowers bend low in courtesy, Each wave flings up a shower","of pearls, The flag in front of the school unfurls.",gutenberg
4073,"Laughing, dancing, sunny wind,","Whistling, howling, rainy wind, North, South, East and West,",Each is the wind I like the best.,gutenberg
4074,By day you cannot,see the sky For it is,up so very high.,gutenberg
4075,"You look and look,",but it's so blue That you,can never see right through.,gutenberg
4076,But when night comes it,"is quite plain, And all the",stars are there again.,gutenberg
4077,They seem just like old,"friends to me, I've known them",all my life you see.,gutenberg
4078,"There is the dipper first, and there Is","Cassiopeia in her chair, Orion's belt, the","Milky Way, And lots I know but cannot say.",gutenberg
4079,"One group looks like a swarm of bees, Papa",says they're the Pleiades; But I think they must be the,toy Of some nice little angel boy.,gutenberg
4080,Perhaps his jackstones which to-day He has,"forgot to put away, And left them lying on the",sky Where he will find them bye and bye.,gutenberg
4081,I wish he'd,come and play,with me.,gutenberg
4082,"We'd have such fun, for it would",be A most unusual thing for boys,To feel that they had stars for toys!,gutenberg
4083,“We grasp our battle-spears:,we don our,breast-plates of hide.,gutenberg
4084,The axles of,our chariots touch: our,short swords meet.,gutenberg
4085,Standards obscure the,sun: the foe roll,up like clouds.,gutenberg
4086,Arrows fall thick:,the warriors,press forward.,gutenberg
4087,They menace,our ranks: they break,our line.,gutenberg
4088,The left-hand trace-horse,is dead: the one on,the right is smitten.,gutenberg
4089,The fallen horses,block our wheels: they impede,the yoke-horses!,gutenberg
4090,” They grasp their jade,drum-sticks: they beat the,sounding drums.,gutenberg
4091,Heaven decrees their,fall: the dread Powers,are angry.,gutenberg
4092,The warriors,are all dead: they lie,on the moor-field.,gutenberg
4093,They issued but shall,not enter: they went but,shall not return.,gutenberg
4094,The plains are,flat and wide: the,way home is long.,gutenberg
4095,Their swords lie beside,"them: their black bows, in",their hand.,gutenberg
4096,Though their limbs were,"torn, their hearts could not",be repressed.,gutenberg
4097,They were more than,brave: they were inspired with,the spirit of “Wu.,gutenberg
4098,” Steadfast to the,"end, they could not",be daunted.,gutenberg
4099,"Their bodies were stricken, but their",souls have taken Immortality-- Captains among,"the ghosts, heroes among the dead.",gutenberg
4100,"To be an orphan,",To be fated to,be an orphan.,gutenberg
4101,How,bitter is this,lot!,gutenberg
4102,When my father and mother,were alive I used to ride in a carriage,With four fine horses.,gutenberg
4103,"But when they both died,",My brother and sister-in-law Sent me out,to be a merchant.,gutenberg
4104,In the south I travelled,to the “Nine Rivers” And in the east as,far as Ch’i and Lu.,gutenberg
4105,My brother,told me to get,ready the dinner.,gutenberg
4106,My sister-in-law,told me to see after,the horses.,gutenberg
4107,I was always going up,into the hall And running down,again to the parlour.,gutenberg
4108,My,tears fell,like rain.,gutenberg
4109,In the morning they,"sent me to draw water, I",didn’t get back till night-fall.,gutenberg
4110,My hands,were all sore And,I had no shoes.,gutenberg
4111,I walked the cold,earth Treading on thorns,and brambles.,gutenberg
4112,As I stopped to,"pull out the thorns, How",bitter my heart was!,gutenberg
4113,My tears fell and,fell And I went on,sobbing and sobbing.,gutenberg
4114,In winter I,have no great-coat; Nor in,"summer, thin clothes.",gutenberg
4115,It is,no pleasure to be,alive.,gutenberg
4116,I had rather quickly,leave the earth And go beneath,the Yellow Springs.,gutenberg
4117,The April winds blow,And the grass is,growing green.,gutenberg
4118,In the third month--silkworms,"and mulberries, In",the sixth month--the melon-harvest.,gutenberg
4119,I went out with the melon-cart,And just as I was coming home The,melon-cart turned over.,gutenberg
4120,"The people who came to help me were few, But","the people who ate the melons were many, All they left me",was the stalks-- To take home as fast as I could.,gutenberg
4121,My brother and sister-in-law,"were harsh, They asked me all sorts",of awful questions.,gutenberg
4122,Why does,everyone in the,village hate me?,gutenberg
4123,I want to write a letter and send it To my mother,"and father under the earth, And tell them I can’t go on any",longer Living with my brother and sister-in-law.,gutenberg
4124,She had been ill for years,and years; She sent for me,to say something.,gutenberg
4125,She couldn’t say what she,wanted Because of the tears that,kept coming of themselves.,gutenberg
4126,“I have burdened you with,"orphan children, With orphan",children two or three.,gutenberg
4127,Don’t let our children,go hungry or cold; If they do,"wrong, don’t slap or beat them.",gutenberg
4128,When you take,"out the baby, rock",it in your arms.,gutenberg
4129,Don’t forget,to do that.,,gutenberg
4130,"” Last she said, “When I carried them in",my arms they had no clothes And now their,jackets have no linings.,gutenberg
4131,_ I shut the doors and,barred the windows And left the,motherless children.,gutenberg
4132,When I got,to the market and met,"my friends, I wept.",gutenberg
4133,I sat down,and could not go,with them.,gutenberg
4134,I asked them,to buy some cakes for,my children.,gutenberg
4135,In the presence,of my friends I,sobbed and cried.,gutenberg
4136,I tried not,"to grieve, but sorrow",would not cease.,gutenberg
4137,I felt in,my pocket and gave my,friends some money.,gutenberg
4138,When I got home I found,my children Calling to be taken,into their mother’s arms.,gutenberg
4139,I walked up and down,in the empty room This way,and that a long while.,gutenberg
4140,Then I went away from,it and said to myself “I will forget,and never speak of her again.,gutenberg
4141,” In the eastern,"quarter dawn breaks, the stars",flicker pale.,gutenberg
4142,The morning cock,at Ju-nan mounts the,wall and crows.,gutenberg
4143,"The songs are over,","the clock run down, but still",the feast is set.,gutenberg
4144,The moon grows dim,and the stars are few; morning,has come to the world.,gutenberg
4145,At a thousand gates and ten thousand,doors the fish-shaped keys turn; Round the Palace and up by the,"Castle, the crows and magpies are flying.",gutenberg
4146,We go to the,Golden Palace: We,set out the jade cups.,gutenberg
4147,We summon the,honoured guests To enter,at the Golden Gate.,gutenberg
4148,They enter at the,Golden Gate And go to,the Golden Hall.,gutenberg
4149,In the Eastern Kitchen the,meat is sliced and ready-- Roast beef,and boiled pork and mutton.,gutenberg
4150,The Master,of the Feast hands round,the wine.,gutenberg
4151,The harp-players,sound their clear,chords.,gutenberg
4152,The cups are pushed aside and,we face each other at chess: The rival,pawns are marshalled rank against rank.,gutenberg
4153,The fire glows and the,smoke puffs and curls; From the incense-burner rises,a delicate fragrance.,gutenberg
4154,The clear wine has made,our cheeks red; Round the table,joy and peace prevail.,gutenberg
4155,May those who shared in this,day’s delight Through countless autumns enjoy,like felicity.,gutenberg
4156,At fifteen I,"went with the army, At",fourscore I came home.,gutenberg
4157,On the way I met a man,"from the village, I asked him",who there was at home.,gutenberg
4158,“That over there is your,"house, All covered over with",trees and bushes.,gutenberg
4159,” Rabbits had run in,"at the dog-hole, Pheasants flew down from",the beams of the roof.,gutenberg
4160,In the courtyard was growing,"some wild grain; And by the well,",some wild mallows.,gutenberg
4161,I’ll boil the grain and,"make porridge, I’ll pluck the",mallows and make soup.,gutenberg
4162,Soup and porridge,"are both cooked, But there is no",one to eat them with.,gutenberg
4163,I went out and looked,"towards the east, While tears fell",and wetted my clothes.,gutenberg
4164,In a narrow road where there,was not room to pass My carriage met,the carriage of a young man.,gutenberg
4165,And while his axle was touching,my axle In the narrow road I,asked him where he lived.,gutenberg
4166,“The place where I live is easy,"enough to find, Easy to find and",difficult to forget.,gutenberg
4167,In the midst of the courtyard grows,"a cassia-tree,-- And candles on its branches",flaring away in the night.,gutenberg
4168,” They fought south,"of the Castle, They died",north of the wall.,gutenberg
4169,They died,in the moors and were,not buried.,gutenberg
4170,Their flesh,was the,food of crows.,gutenberg
4171,“Tell the crows we are not,afraid; We have died in the moors,and cannot be buried.,gutenberg
4172,"Crows, how can our",bodies escape,you?,gutenberg
4173,” The waters flowed deep,And the rushes in,the pool were dark.,gutenberg
4174,The riders fought,and were slain: Their horses,wander neighing.,gutenberg
4175,By the,bridge there was,a house.,gutenberg
4176,Was it,"south, was it",north?,gutenberg
4177,The harvest,was never,gathered.,gutenberg
4178,How can,we give you your,offerings?,gutenberg
4179,You served your,"Prince faithfully,",Though all in vain.,gutenberg
4180,"I think of you, faithful",soldiers; Your service shall not,be forgotten.,gutenberg
4181,For in the morning you,went out to battle And at,night you did not return.,gutenberg
4182,I went out at,the eastern gate: I never,thought to return.,gutenberg
4183,But I came back to,the gate with my heart,full of sorrow.,gutenberg
4184,There was not a peck of,rice in the bin: There was not a coat,hanging on the pegs.,gutenberg
4185,So I took,my sword and went,towards the gate.,gutenberg
4186,My wife and child clutched at my coat,and wept: “Some people want to be rich and grand: I only,want to share my porridge with you.,gutenberg
4187,"Above, we have the blue waves","of the sky: Below, the yellow",face of this little child.,gutenberg
4188,"” “Dear wife,",I cannot,stay.,gutenberg
4189,Soon,it will be,too late.,gutenberg
4190,When one is growing,old One cannot put,things off.,gutenberg
4191,” She went up the mountain to pluck,wild herbs; She came down the mountain and,met her former husband.,gutenberg
4192,She knelt down and asked,her former husband “What do you,find your new wife like?,gutenberg
4193,"” “My new wife, although her","talk is clever, Cannot charm me",as my old wife could.,gutenberg
4194,In beauty of,face there is not,much to choose.,gutenberg
4195,But in usefulness,they are not at,all alike.,gutenberg
4196,My new wife comes in from,the road to meet me; My old wife always,came down from her tower.,gutenberg
4197,My new wife is clever,at embroidering silk; My old,wife was good at plain sewing.,gutenberg
4198,Of silk embroidery one,can do an inch a day; Of plain,"sewing, more than five feet.",gutenberg
4199,Putting her silks by the side,"of your sewing, I see that the new",will not compare with the old.,gutenberg
4200,” My love is,living To the,south of the Great Sea.,gutenberg
4201,What shall,I send,to greet him?,gutenberg
4202,Two pearls and a comb,of tortoise-shell: I’ll send them to him packed,in a box of jade.,gutenberg
4203,They tell me he is not true: They tell me,"he dashed my box to the ground, Dashed it to the ground and burnt",it And scattered its ashes to the wind.,gutenberg
4204,From this day to the ends,"of time I must never think of him,",Never again think of him.,gutenberg
4205,"The cocks are crowing, And",the dogs are barking-- My brother,and his wife will soon know.,gutenberg
4206,The autumn wind is,blowing; The morning,wind is sighing.,gutenberg
4207,In a moment the,sun will rise in the east And,then _it_ too will know.,gutenberg
4208,I am a prisoner,"in the hands of the enemy, Enduring",the shame of captivity.,gutenberg
4209,My bones stick out and,my strength is gone Through not getting,enough to eat.,gutenberg
4210,My brother is a,Mandarin And his horses,are fed on maize.,gutenberg
4211,Why can’t he spare a,little money To send,and ransom me?,gutenberg
4212,If you were riding in a coach,"And I were wearing a “li,” And one day we met","in the road, You would get down and bow.",gutenberg
4213,If you were carrying a “tēng” And I,"were riding on a horse, And one day we met in",the road I would get down for you.,gutenberg
4214,I want to be your,friend For ever and ever without,break or decay.,gutenberg
4215,"How swiftly it dries, The","dew on the garlic-leaf, The dew that dries",so fast To-morrow will fall again.,gutenberg
4216,But he whom we,carry to the grave Will never,more return.,gutenberg
4217,What man’s,land is the,graveyard?,gutenberg
4218,It is the crowded,"home of ghosts,-- Wise and foolish",shoulder to shoulder.,gutenberg
4219,The King of the,Dead claims them all; Man’s fate,knows no tarrying.,gutenberg
4220,"On and on, always","on and on Away from you,",parted by a life-parting.,gutenberg
4221,Going from one another,"ten thousand “li,” Each in a different",corner of the World.,gutenberg
4222,The way between is,"difficult and long, Face to face",how shall we meet again?,gutenberg
4223,Since we parted the time,"is already long, Daily my",clothes hang looser round my waist.,gutenberg
4224,Floating clouds obscure the,"white sun, The wandering one",has quite forgotten home.,gutenberg
4225,Thinking of you has made,"me suddenly old, The months and",years swiftly draw to their close.,gutenberg
4226,I’ll put you out of my,mind and forget for ever And try,with all my might to eat and thrive.,gutenberg
4227,"Green, green,",The grass by the,river-bank.,gutenberg
4228,"Thick, thick, The",willow trees in,the garden.,gutenberg
4229,"Sad, sad,",The lady in,the tower.,gutenberg
4230,"White, white,",Sitting at the casement,window.,gutenberg
4231,"Fair, fair,",Her red-powdered,face.,gutenberg
4232,"Small, small,",She puts out her,pale hand.,gutenberg
4233,Once she,was a,dancing-house girl.,gutenberg
4234,Now she,is a wandering,man’s wife.,gutenberg
4235,The wandering,"man went, but did",not return.,gutenberg
4236,It is hard,alone to keep,an empty bed.,gutenberg
4237,"Green, green, The",cypress on,the mound.,gutenberg
4238,"Firm, firm,",The boulder,in the stream.,gutenberg
4239,Man’s life lived within this,"world, Is like the sojourning of",a hurried traveller.,gutenberg
4240,A cup of wine together,"will make us glad, And a little",friendship is no little matter.,gutenberg
4241,Yoking my,chariot I urge my stubborn,horses.,gutenberg
4242,I wander,about in the streets,of Wan and Lo.,gutenberg
4243,In Lo Town,how fine,everything is!,gutenberg
4244,The “Caps and,Belts” go seeking,each other out.,gutenberg
4245,The great boulevards are,"intersected by lanes, Wherein",are the town-houses of Royal Dukes.,gutenberg
4246,The two palaces stare,"at each other from afar, The",twin gates rise a hundred feet.,gutenberg
4247,By prolonging the feast,"let us keep our hearts gay, And leave",no room for sadness to creep in.,gutenberg
4248,Of this day’s glorious,feast and revel The pleasure and delight,are difficult to describe.,gutenberg
4249,Plucking the lute they sent,"forth lingering sounds, The new melodies",in beauty reached the divine.,gutenberg
4250,Skilful singers intoned,"the high words, Those who knew the tune heard",the trueness of their singing.,gutenberg
4251,We sat there each with the same desire And,like thoughts by each unexpressed: “Man in the world lodging for a single life-time,Passes suddenly like dust borne on the wind.,gutenberg
4252,Then let us hurry out with high steps And be,the first to reach the highways and fords: Rather than stay at home,wretched and poor For long years plunged in sordid grief.,gutenberg
4253,” In the north-west there is,"a high house, Its top level",with the floating clouds.,gutenberg
4254,Embroidered curtains thinly,"screen its windows, Its storied tower",is built on three steps.,gutenberg
4255,From above there comes,"a noise of playing and singing,","The tune sounding, oh!",gutenberg
4256,Who can it,"be, playing so sad",a tune?,gutenberg
4257,Surely it,must be Ch’i Liang’s,wife.,gutenberg
4258,The tranquil “D” follows,"the wind’s rising, The middle",lay lingers indecisive.,gutenberg
4259,"To each note, two or","three sobs, Her high will conquered by",overwhelming grief.,gutenberg
4260,She does not regret that she,"is left so sad, But minds that so few",can understand her song.,gutenberg
4261,She wants to become,those two wild geese That with beating,wings rise high aloft.,gutenberg
4262,Crossing the river I,pluck hibiscus-flowers: In the orchid-swamps,are many fragrant herbs.,gutenberg
4263,I gather,"them, but who shall",I send them to?,gutenberg
4264,My love,is living in lands,far away.,gutenberg
4265,I turn and look towards,my own country: The long road,stretches on for ever.,gutenberg
4266,"The same heart, yet a different","dwelling: Always fretting, till",we are grown old!,gutenberg
4267,A bright moon illumines,the night-prospect: The house-cricket chirrups on,the eastern wall.,gutenberg
4268,The Handle of the,Pole-star points to the Beginning,of Winter.,gutenberg
4269,The host of stars,is scattered over,the sky.,gutenberg
4270,The white dew wets the,"moor-grasses,-- With sudden swiftness the",times and seasons change.,gutenberg
4271,The autumn cicada,"sings among the trees, The swallows,","alas, whither are they gone?",gutenberg
4272,Once I had a,"same-house friend, He took flight and",rose high away.,gutenberg
4273,He did not remember how,"once we went hand in hand, But left me like",footsteps behind one in the dust.,gutenberg
4274,In the South is the Winnowing-fan,"and the Pole-star in the North, And a Herd-boy whose ox",has never borne the yoke.,gutenberg
4275,A friend who is not firm as,a great rock Is of no profit,and idly bears the name.,gutenberg
4276,In the courtyard there grows,"a strange tree, Its green leaves ooze",with a fragrant moisture.,gutenberg
4277,Holding the branch I cut a,"flower from the tree, Meaning to send it away",to the person I love.,gutenberg
4278,Its sweet,smell fills my sleeves,and lap.,gutenberg
4279,The road is,"long, how shall I get",it there?,gutenberg
4280,Such a thing is not fine enough,to send: But it may remind him of the time,that has past since he left.,gutenberg
4281,Far away twinkles the,Herd-boy star; Brightly shines the Lady,of the Han River.,gutenberg
4282,"Slender, slender",she plies her white,fingers.,gutenberg
4283,"Click, click go",the wheels of her,spinning-loom.,gutenberg
4284,At the end of the day,she has not finished her task; Her bitter,tears fall like streaming rain.,gutenberg
4285,The Han River runs,shallow and clear; Set between,"them, how short a space!",gutenberg
4286,But the river water will not,"let them pass, Gazing at each other",but never able to speak.,gutenberg
4287,Turning my,chariot I yoke my,horses and go.,gutenberg
4288,On and on down the,long roads The autumn winds shake,the hundred grasses.,gutenberg
4289,On every,"side, how desolate",and bare!,gutenberg
4290,The things I meet are,"all new things, Their strangeness hastens",the coming of old age.,gutenberg
4291,Prosperity,and decay each have their,season.,gutenberg
4292,Success is bitter,when it is slow,in coming.,gutenberg
4293,Man’s life is not metal,"or stone, He cannot far prolong",the days of his fate.,gutenberg
4294,Suddenly,he follows in the,way of things that change.,gutenberg
4295,Fame is the,only treasure that,endures.,gutenberg
4296,The Eastern Castle,stands tall and high; Far and wide,stretch the towers that guard it.,gutenberg
4297,The whirling wind uprises,and shakes the earth; The autumn grasses,grow thick and green.,gutenberg
4298,The four seasons alternate,"without pause, The year’s end hurries",swiftly on.,gutenberg
4299,The Bird of the Morning Wind,is stricken with sorrow; The frail,cicada suffers and is hard pressed.,gutenberg
4300,"Free and clear, let",us loosen the,bonds of our hearts.,gutenberg
4301,Why should we,go on always,restraining and binding?,gutenberg
4302,In Yen and Chao are,"many fair ladies, Beautiful people",with faces like jade.,gutenberg
4303,Their clothes,are made all of,silk gauze.,gutenberg
4304,They stand at,the door practising,tranquil lays.,gutenberg
4305,The echo,"of their singing,",how sad it sounds!,gutenberg
4306,By the pitch of,the song one knows the,stops have been tightened.,gutenberg
4307,To ease their minds they arrange,"their shawls and belts; Lowering their song, a",little while they pause.,gutenberg
4308,“I should like to be those two flying,swallows Who are carrying clay to,nest in the eaves of your house.,gutenberg
4309,” I drive my chariot up to,the Eastern Gate; From afar I see,the graveyard north of the Wall.,gutenberg
4310,The white aspens how they,"murmur, murmur; Pines and cypresses",flank the broad paths.,gutenberg
4311,Beneath lie men who,"died long ago; Black, black is",the long night that holds them.,gutenberg
4312,Deep down beneath the,"Yellow Springs, Thousands of",years they lie without waking.,gutenberg
4313,In infinite succession,"light and darkness shift, And years vanish",like the morning dew.,gutenberg
4314,"Man’s life is like a sojourning,",His longevity lacks the firmness,of stone and metal.,gutenberg
4315,For ever it has been,"that mourners in their turn were mourned, Saint","and Sage,--all alike are trapped.",gutenberg
4316,Seeking by food to obtain,Immortality Many have,been the dupe of strange drugs.,gutenberg
4317,Better far to drink,good wine And clothe our bodies,in robes of satin and silk.,gutenberg
4318,The dead are gone and,with them we cannot,converse.,gutenberg
4319,The living are,here and ought to have,our love.,gutenberg
4320,Leaving the city-gate I look,ahead And see before me,only mounds and tombs.,gutenberg
4321,The old graves are ploughed,"up into fields, The pines and cypresses",are hewn for timber.,gutenberg
4322,In the white aspens sad,winds sing; Their long murmuring,kills my heart with grief.,gutenberg
4323,I want to go,"home, to ride to my",village gate.,gutenberg
4324,I want to go,"back, but there’s no",road back.,gutenberg
4325,The years of a,lifetime do not,reach a hundred.,gutenberg
4326,Yet they contain,a thousand years’,sorrow.,gutenberg
4327,When days are short and,"the dull nights long, Why not take a",lamp and wander forth?,gutenberg
4328,If you want to be happy,"you must do it now, There is no",waiting till an after-time.,gutenberg
4329,The fool who’s loath to,spend the wealth he’s got Becomes the laughing-stock,of after ages.,gutenberg
4330,It is true that Master,"Wang became immortal, But how can",_we_ hope to share his lot?,gutenberg
4331,"Cold, cold the year draws to its","end, The crickets and grasshoppers",make a doleful chirping.,gutenberg
4332,The chill wind,increases its,violence.,gutenberg
4333,My wandering,love has no coat to,cover him.,gutenberg
4334,He gave his embroidered furs,"to the Lady of Lo, But from me his",bedfellow he is quite estranged.,gutenberg
4335,Sleeping alone in the depth,of the long night In a dream I thought,I saw the light of his face.,gutenberg
4336,My dear one thought of our,"old joys together, He came in his",chariot and gave me the front reins.,gutenberg
4337,I wanted so to prolong,"our play and laughter, To hold his",hand and go back with him in his coach.,gutenberg
4338,"But, when he had come he",would not stay long Nor stop to go with me,to the Inner Chamber.,gutenberg
4339,Truly without the falcon’s,wings to carry me How can I rival,the flying wind’s swiftness?,gutenberg
4340,I go and lean at the,"gate and think of my grief, My falling",tears wet the double gates.,gutenberg
4341,At the beginning of,"winter a cold spirit comes,","The North Wind blows--chill, chill.",gutenberg
4342,"My sorrows being many, I","know the length of the nights, Raising my head I",look at the stars in their places.,gutenberg
4343,On the fifteenth day the bright,"moon is full, On the twentieth",day the “toad and hare” wane.,gutenberg
4344,” I put the letter away,"in the folds of my dress, For three years the",writing did not fade.,gutenberg
4345,How with an undivided,heart I loved you I fear that you,will never know or guess.,gutenberg
4346,"The bright moon, oh, how white","it shines, Shines down on the gauze",curtains of my bed.,gutenberg
4347,Racked by sorrow,I toss and cannot,sleep.,gutenberg
4348,Picking up,"my clothes, I wander",up and down.,gutenberg
4349,My absent love says that he,"is happy, But I would rather he",said he was coming back.,gutenberg
4350,Out in the courtyard,"I stand hesitating,",alone.,gutenberg
4351,To whom,can I tell the sad,thoughts I think?,gutenberg
4352,Staring before me I,enter my room again; Falling,tears wet my mantle and robe.,gutenberg
4353,Autumn wind,rises: white,clouds fly.,gutenberg
4354,Grass and,trees wither:,geese go south.,gutenberg
4355,Orchids all,in bloom: chrysanthemums,smell sweet.,gutenberg
4356,I think of my,lovely lady: I never,can forget.,gutenberg
4357,Across the mid-stream white waves rise Flute and,drum keep time to sound of the rowers’ song; Amidst revel,"and feasting, sad thoughts come; Youth’s years how few!",gutenberg
4358,,Age how,sure!,gutenberg
4359,The sound,of her silk,skirt has stopped.,gutenberg
4360,On the marble,pavement dust,grows.,gutenberg
